Question,Answer
"You have kids, would you make it 15, 16 years old?","I think it would be healthier. Well, look, we have minimum age for alcohol. That's, you know, that's older than you have to be to fight in a war for God's sakes. It's ridiculous. You know, we have cannabis, cannabis is still banned at the federal, the hypocrisy of the federal government is also what I'm running against right now. So Jason, I think that is a good idea. You know this. And I've had daughters that grew up in the social media era. It is one of the most destructive, it is far, it is as destructive as I think drug consumption to adolescent health as anything else. So to answer your question, I think that's a perfectly legal, be perfectly reasonable, and you can't just entrust parents to do it because Johnny's parents will allow them to have the phone and the apps, you know, and Jill's won't. There has to be. I think there has to be. We do that for a lot of other things. And I think we should talk about at what age any of this is reasonable, but absolutely, I think that's not unreasonable. I want kids to be safe just like you guys. And so does everybody. That sounds like driving a car is a good back then, 15, 16, 17 years old. We should also allow kids to learn how to drink before they learn how to drive. We're the only country that does it like this, you know, drive for five years until you legally can drink. So when you have your first drink, you don't even know what it's going to do to you. You know, it's absurd."
What's the strategy you'd enjoy to achieve those goals and who are the people that you'd surround yourself with?,"Well, I'll tell you, my strategy is quite simple. It's peace around the world and it's prosperity at home, plain and simple. And I can build, I can put the legs of that stool together for you as quickly as I possibly can. But let's talk about the Middle East. You know, I'm 54 years old. President Biden has been in the U.S. Senate or in the White House for 50 years. None of us on this podcast have lived through anything but bloodshed, reciprocal misery between Palestinians and Israelis. This cycle has continued for decades. I've had enough. I cannot stand the sight of babies being pulled from the wombs of mothers by Hamas and Israel any more than I can watch babies being destroyed by bombs and missiles in Gaza. And it's got to stop. I am about to issue a statement to that end that says, essentially, Hamas must release all of its hostages, period, of which there are nine Americans, guys. Nine Americans are being held in Gaza by a terrorist organization. And as president, I would be making that my, not my daily desire or request, my daily demand, all hands on deck, these hostages must be released immediately."
Would you send in special forces to collect them?,"I would, absolutely. It is incumbent on the president of the United States to extract Americans being held against their will by any foreign entity. I don't know. Got to ask him. But good luck asking him because he doesn't do any press conferences. The goal for peace is reasonable, but maybe some specifics around your strategy. I know. So let me, yeah. Yeah, yeah, yeah. Okay, so first, at the moment, the hostages are safely released. There should be a ceasefire, period. And at that very moment, there should be a multinational peacekeeping force sent into Gaza to maintain security immediately. And when I say multinational, the very nations that are connected to Gaza, Arab nations have to be part of it, not the United States, not Israel, of course, but a significant force there to keep the peace immediately. Concurrently, a multinational coalition designed to eliminate Hamas by every nation in the world that wants them eliminated, which frankly is most. And then we have got to invest again, nations of the world, investing in a democratic civil society, infrastructure, education, facilities and security so that a new generation of Palestinian leaders can create a circumstance whereby another nation can be created, period. And it's not going to happen with Israel and Palestinians trying to do this. It has got to be imposed. It has got to be a coalition of the willing. And then only then will we see the conditions for, hopefully, elections for Palestinians for the first time since 2006, 17 years. And concurrently, it is time for Israelis to call an election to replace Benjamin Netanyahu because he is absolutely part of Israel's security problem. I've looked him in the eye. I told him before this happened earlier this year, I've been with him twice, looked him in the eye. I said, what you are doing is affecting the relationship with the United States and Israel and will absolutely affect security moving forward. I had no idea what would be coming on October 7th. But the settlement policy, the right-wing government, the distraction that the Judicial Reform Initiative has created in that country is made the conditions ripe. And by the way, having been in Riyadh recently too, it was really getting close. The Saudis and Israelis normalizing. And that was exactly why I believe whether implicit or explicit, Iran inspired Hamas to do this then. And by the way, in the United States, mark my words, our adversaries are watching the dysfunction and distraction right now with the same open eyes. And we have borders that are awfully easily to get in. And that's the truth. And I'm a Democrat saying that. I would do this entirely differently."
Tell us what would you do there?,"Once again, I've got a lot of colleagues who make their decisions by reading an article, seeing a tweet or seeing a TikTok. I go, I've been to Israel and the Middle East twice just in the last number of months. I've been to the southern border twice. I've seen with my own eyes, it is the most despicable, embarrassing failure of American policy I have ever seen. I have seen women walking across the Rio Grande with babies in their arms who have spent six or $7,000 their whole life savings, paid to gangs and coyotes to bring them across the border. I've seen the extraordinary beauty and grace with which Border Patrol agents have looked after these people. I've seen babies who were abandoned that were on 24-hour care of Border Patrol agents who took as good a care of these little kids as they would their own. I saw people in cages. I saw the most archaic out-of-date, inefficient, ineffective ports of entry. I saw lines of trailer trucks, probably two, three miles long, idling in the hot, hot weather, waiting to get across. I saw a mile long of human beings waiting to come into the country to do their shopping or their job or their education. And it was horrifying. And if we think, by the way, we need much better border security, barriers, technologies, and facilities. And by the way, we also needed it at the northern border. I'm a border state in Minnesota. People walk across farm fields in Manitoba and to Minnesota. We don't know who they are. Some of them get caught. That's true. But I'll tell you guys, if we think that we can solve the problem at the border, that's the issue right there. This administration and past ones just don't get it. We should be adjudicating asylum cases in countries of origin."
Why make these poor people take their life savings that they have no money?,"They're set off in the streets here. They're supposed to come back to a court two years from now. Let them keep their money. Let's build dormitories next to our consulates or our embassies in the northern triangle countries wherever migrants are coming. Create some safety security there. Invest in local economies so that there can be some opportunity. And adjudicate their cases there if they qualify. Let's bring them to America with six or $7,000 in their pocket so they can start a nice new life and pursue the American dream. And if they don't, they will be kept in their countries of origin. And of course, we have to work with Mexico as well. But this is not rocket science. It's simple problem solving. And the fact that we continue to do this stupid policy to this day, you guys, is unfair. On the other side of this, talk about recruiting. Many countries, Canada, New Zealand, a lot of the Nordics have a point-based system, and they actively recruit talent. You're an entrepreneur. You've been CEO of multiple companies. It is an absolute arduous pain to get talented people here right now. Recruitment of talent in the United States is bundled with the southern border."
Would you be in favor of a point-based system and recruitment of talent to get more talented immigrants in our country?,"Which, by the way, three of the four besties here were not born in the United States. Which is an excellent... And by the way, my four mothers and four fathers came here for the same reasons. Same reasons that every one of those moms and dads is coming across the Rio Grande. So to answer your question directly, Jason, I think we can do both. I think we should have a merit-based system to attract the best and brightest and most talented. I'm sure all of you had came from enterprises that would afford benefits, perhaps education to people. You would expect them to actually stay at your enterprise for a number of years to kind of, as a payback. We are right now... The United States is training some of the best and brightest in the world, not creating opportunities to stay. And of course, Canada is the beneficiary. The Nordic countries, European countries, you guys know this. This notion that we can't do two things at once, that we can't welcome the most disadvantage who simply want to pursue an American dream and start at the very bottom and match that with some of the best and brightest who can actually start at the very top. My goodness."
Yes or no?,"It's nonsense. Before we run out of time. Oh, darn, that's way too short. No, for you. I think we got a little over time. I got more. Hey, I got time, guys. Oh, okay, great. We really want to talk. I got time. Yeah. Freeberg and I are... I think Freeberg moved me to his position on this. Number one issue for this election, Freeberg, correct me if I'm wrong for you, is still our out of control spending. Freeberg, maybe you could tee this up. Yeah, I mean, I've said this in the past. I think the US is facing a fiscal emergency in the sense that arithmetic starts to play out, that the cost of debt spirals. We can't accomplish any of the other stuff we're talking about unless we can figure this out. We have $33 trillion of debt today. The Treasury estimates it's going to grow to $47 trillion by 2033, just 10 years away. Yeah. $1.5 trillion in deficit this year, trillion in debt interest expense alone this year, and a third of our debt is coming up to be refinanced soon. It's going to get refinanced at 4.5% interest rate instead of 2.5% sitting out today. So the interest will swell, the deficit will swell, the debt will swell, and we're already taxing 18% of GDP as federal revenue, which a lot of economists have shown. You can only get to 20% at which point economy starts to shrink. There's pretty good research on this. Some would argue differently, but I think that's a natural limit."
"A lot of people have said that this is the late-stage empire, the failure of democracy because everyone votes themselves all the money eventually, or is it a politically-oriented problem where folks don't want to address the biggest line items, they don't want to hold programs to account, and what is the answer here?","So to answer your question directly, you asked what the cause is. It's incompetency and perverse incentives, period. There used to be a political reward for conservatives who were focused on fiscal responsibility because they would win elections over tax insenders, but that party is long gone, long gone. There's no reward. That's why Trump added $7 trillion to the deficit, and that's why Biden will probably add about that much as well. So, by the way, I think I'm one of the only Democrats who has been named by the committee for a responsible federal budget, one of their fiscal heroes as a Democrat, and also I'm a Hamilton Jefferson Award winner by the U.S. Chamber of Commerce. And I'm also a pro-worker. This notion that you can't be, by the way, pro-business and pro-worker, that they're somehow mutually exclusive, that's BS. They're mutually mandatory. But back to your question, $33 trillion in debt, by the way, our economy can accommodate more. That's the sad truth. The issue is our debt service, and nobody's talking about the fact that it is going to go from the mid-400 billion a year to to your point, Dave, with the higher interest rates, probably approaching a trillion, maybe $840 trillion. No, it's already over a trillion."
Is it $1 trillion today?,"It's going to be $1 trillion five. I would argue that maybe we could have a little argument about if it's there quite yet, but none, either way. Let's call it a trillion. That means literally, we are spending way more for the past than we are investing in the future. That means we have literally no dollars left for any discretionary spending. Every bit of it is now consumed by Social Security, Medicare, and our military. On top of that, we've got people sleeping on the streets in every single town and city in America. We have kids going to school hungry. We have one of the most, to me, failing public school systems in the entire developed world. We have a healthcare system that is not healthcare, it's sick care, a fee for service model that should be capitated, and our outcomes are mid-pack. We have a $2 trillion deficit, and by the way, no childcare, no pre-K education. I can go on down the list. It's nonsensical, and we're spending $2 trillion more. So to answer your question, you guys know the answer here. We're a country with, I think, $150-some trillion in total United States household wealth."
Where do you cut?,Let's start by getting into those specifics.
"Where do you cut, and how do you cut?","So here's what I would do. Starting with Social Security. Social Security, you guys, is the most successful anti-poverty program in world history. And I believe it would be not just a dereliction of duty. It would be counter to every American principle if senior citizens struggled. By the way, we don't have a culture in America that takes care of the elders, like in most Asian cultures and other wonderful cultures in the world. So absent that, we have to afford resources. So two things. As you all know, Social Security, the trust fund, will face probably reductions in about 25% cut levels by 2033, based on the current path. Two easy things we can do. $160,000 a year is the cap right now, I think, roughly. We should make that $250. That means it's a very regressive tax. If you're making $160,000, you're paying a whole lot more of your income than someone making $250,000, $300,000 a year, not to mention $3 million or $30 million. So we should raise the cap to $250,000, make sure that fund at least is solvent through probably 2046, 2047. And then I would do something different for the first time in American history. For all the millions of Americans who've done well, don't need their Social Security, that wish to become philanthropists, I would create a pool, that goes back to the Treasury, a pool that would be automatically redistributed to the lowest 5% or 10% of all Social Security recipients in the entire country. And let's say it might be a $500 boost, it might be a $1,000 boost a year for the most challenged elderly Americans. But when 40% of Americans can't afford a $400 car repair or emergency expense, not for this group, but my to your point, I think it was the Fed or it was Treasury that published a study, I was shocked by the actual number of American millionaires that exist. And it's counter to the narrative because you would, if you just read the headlines, you think America is an economic despair, and it's not true. And the wealth creation is actually quite pervasive, which is a great feature of American capitalism. So to your point, there are a lot of people who would be willing to pay it forward to folks that didn't have it if you gave them the choice, it's just not possible today. So why shouldn't we be a government that creates, so just, Chamatham, I got to say, one of my perspectives and intentions is to not necessarily, by the way, we don't have to spend money to expose young people who never get out of their neighborhoods in many cities in this country, expose them to possibility, get them into factories and to add agencies and to high tech centers, show them rockets and music makers and artists. We don't need to spend a whole lot more money to simply completely change the path of young Americans' lives, not to mention old Americans' lives. And that's just a perfect example of a simple solution that costs zero and lets Americans actually be Americans. Okay, so now go to Medicare, but I think I know what you're going to say because you mentioned it, capitation, but maybe talk very quickly on that and then military."
What do you cut there?,"Yeah, so quickly on healthcare, look guys, I represent United Health Group in my district. Tens of thousands of Minnesotans, many of them who live in my district, earn very handsome salaries from United. They've done some great work in many ways, but I have to tell you, since I've joined Congress in my third term now, you would be in tears if you had to sit with the people that I've sat with over so many occasions who thought they had coverage, whose son got sick or whose mother broke a leg or something, and they literally have gone bankrupt or take on tens of thousands of dollars in medical debt and they get surprise bills. And then they read in the paper that their health insurer reported annual net income of over $20 billion. And I don't know how you guys feel, but I got to tell you, I'm a capitalist, I'm also compassionate, and I can no longer reconcile that. I really can't. There's a reason we're the only nation in the world that does it this way. I think it's time, by the way, from Roosevelt to Truman to Richard Nixon. Richard Nixon proposed universal health coverage, and it was Ted Kennedy that undermined it, if you can imagine that. If we don't, if conservatives and progressives don't come to the table and talk about how we can deliver a national health insurance program that is portable, let's gig economy participants do their thing, that people don't have to make choices about where to work just because of the healthcare. I don't know why we wouldn't talk about that. And by the way, I'm not talking about the provision of care. It's really important because Fox News and some Republicans have tried to say this is a socialized solution. Just the coverage, because the money is in the system already between three, four, five, six X pharma costs between two X health per capita health costs, 10,000 per person compared to any country in the world at five. The answer is, I think right there in front of us, the money's in the system would not require a tax increase. I think we could actually save substantial money. I'm working on a proposition right now. I would argue that the model is part of the problem. Fee for service is antithetical to what we need. We need a capitated model that gives an incentive to the, to the providers to keep people out of the hospital, at least try, at least try. So that's the answer on that. And by the way, you know, right now Medicare, as you probably know, it covered, I think 23% of the mayor of the country or no, between Medicare and the VA, which are single payer systems, 25% of Americans right now are covered by a single payer system. And by the way, it works better than the other system. Medicare recipients are pretty pleased. This would also be a huge benefit as a capitalist running companies. I mean, how much of your time was spent running your companies dealing with healthcare and the dysfunction of employees staying at companies because they couldn't awful, get healthcare in another company."
What would you do?,"Okay, now military, and this is where how to answer your question very directly. Once again, nobody can tell you that they can even begin to address our fiscal challenges without looking at that ridiculous number, approaching a trillion dollars a year. And by the way, the Pentagon has not passed an audit. They would, in my administration, it would, there would be a top down assessment of every single program, every single base and facility, every explanation of why we are in those 80 nations. And whether or not we should be employing 21st century strategies to keep our country safe. And I think one of the simplest solutions, you guys, is we should be entrusting countries more approximate to the problems to manage them. Doesn't mean we're not a good ally anymore. It just doesn't mean that we are in a position any longer to be the policemen for the entire world when we can barely take damn care of our country itself. It's just so damn simple. And I'm frustrated by it because as someone who lost his father in a completely obnoxious and unnecessary war, a guy that I have on my phone right now, digital audio tapes that he used to send back tapes to my mom, where he says, I've come to the conclusion he loved America. He did not like that war, but he loved America. He said, I believe the only reason we're still here is because so many people are making so much money. He sought and the same thing is happening to this day, you guys, that trillion dollars, that's going somewhere. It's going in people's pockets. And I believe we can cut that and I'm not going to make a proposition, but I believe after a comprehensive assessment that we can save hundreds of billions of dollars that can either be saved on the bottom line or better yet actually invested in human beings instead of the destruction of them, period."
Would you zero base budget?,"Absolutely. Why do, Chimoth, I've had to go back to Washington twice to vote on CRs, continuing resolutions. It is the dysfunction is absurd. There's not a, there may be five people that can read a P and L or a balance sheet in the whole damn Congress. Our budgeting system is completely broken. And yes, as president, I would demand a zero base budgeting and procedure and like I said, a comprehensive independent assessment of every program. And if it is not generating a return or if it could be outsourced to the private sector that can deliver it for a better value, that's how we should proceed. And by the way, it may not be easy. It may take time to get done, but why we don't try is absurd and to answer your final question. If we don't, and once foreign investors no longer consider the United States of America the safest place to deploy capital, it's too late. And I will not, certainly under my watch will not let us get there, but we've got to recraft."
"And lastly, can I say one more thing quick on that, Chimoth?","If the only way that I think we can address the biggest issue in the country, which is the growing disparity between those who have wealth and income and those that do not, we're not a nation that will redistribute. I think we've been not just unsuccessful. We actually created some of the problems we now find ourselves in. The way to do it is to raise the foundation the same way it was raised for me by a good, a stroke of good luck. You know, I was adopted by a dad who gave me everything. And who knows where I would have been if that didn't happen. I want to do the same thing for everybody have healthcare, have great education, have child care, make sure you have a house, a place to live. If we give everybody the same thing, then we can be a country. So let's self-determination and talk about education then briefly. So if the spectrum is the teachers union on one end of the spectrum, and Vivek Ramaswamy, who would dismantle the Department of Education at the federal level and just push all the responsibility to the states with a voucher program, he talked about it here once."
Where are you and what's your philosophy on the state of the education?,I would say I'm in the middle because I think there's some worthiness to both of those perspectives.
What would I do?,"I would fundamentally reinvent American public education with the best and the brightest, with students, with teachers, with families, with the nonprofit sector and the business sector, because right now business needs to participate in 21st century education to advise the teachers and the administrators and the curricula designers what skills they need. They're not even part of the conversation, you guys."
Why is that happening?,"I wish I had a good answer for that. It's appalling, but I do have a good solution. I'm sure like you guys, you all know this, the single most important determinant of a child's success educationally is the quality of their educator. Every single study says the same thing. The United States of America right now, we pay about 81% of the per capita GDP to teachers for compensation. The best performing systems in the world, and there is a correlation, pay 120, 130, sometimes 140, 140% of their per capita GDP. They make teaching one of the most admired, elevated professions in their nation. They identify great teachers when they're still young, and I think we should be a nation that does the same thing. We're not attracting the best and brightest any longer."
