Question,Answer
" Congressman, how should we refer to you today?","Well, I prefer Dean, but, you know, I guess that's... Let's go with Dean. Let's go with that, Mr. Phillips. And just, I'm asking people to be keen on Dean, so it might as well run with it. Ooh, there you go."
"Well, you know what?","I'm the big supporter of the Dean machine, already."
"Oh, you know about the Dean machine?","With this gelato, I'm all up on the Dean machine. By the way, I bought an old international harvester Metro van for 20s when we did activations like South by Southwest and... I used to own one of those, by the way."
"No, you did?","Yeah, I bought it from my ranch. Come on. It's great. I love that, baby. So I bought one for Tlenti, and I saw how people just immediately were attracted to it and fell in love with it. And I thought, hey, when I ran for Congress, I'm going to do the same thing. So I created the government repair truck."
Are you driving around in this international harvester?,"Of course. You're kidding. Yeah. Awesome. I'll show you. I'll send you a picture of it. It's cool. It's awesome. It's got a 1980 Chevy chassis under it, but it's still the basic nuts and bolts. Zach, we're referring to a type of automobile. You can ask one of your three drivers about it, David. Don't worry, David. Your driver can take you in there. Ask your Miami driver. He probably owns some muscle cars. I don't think your LA driver owns muscle cars. Here we go. Let's start this. Three, two... I love you, guys. I'm the queen of Kenwa. I'm going all in. Hey, everybody. Hey, everybody. Welcome to the All In The West. I'm the queen of Kenwa. I'm going all in. Hey, everybody. Hey, everybody. Welcome to the All In Podcast with us again today, the dictator himself, Chamarroph, Polyhapitia, the rain man, David Sacks, and the sultan of science, David Friedberg. We are going to continue our conversation series with presidential candidates today. Our fourth presidential candidate is on the program. Dean Phillips represents Minnesota's third district. He's about 25 years younger than Trump and Biden at 54 years old. Dean, before getting into politics, I understand you were the CEO of your family's spirits business and you ran Talenti Gelato. Oh, that pistachio flavor. Amazing. So, welcome to the All In Podcast. Meet the other besties. And maybe you could just start out by telling us why you are running for president. Yeah. Well, I'll tell you, after being in the vodka business and the ice cream business and actually the coffee business, I think I understand at least what Americans want. So that's a good start. Well, I'll tell you a little about my background and why I'm here. I lost my dad in the Vietnam War when I was just six months old. He had grew up with no money in St. Paul, Minnesota, earned an ROTC scholarship on behalf of the federal government, of course, to pursue his education. Went to Vietnam in 1968 just before I was born, got to see the U.S. land on the moon. And I think regularly about how he looked up two days before his helicopter crashed and he died. Looked up and saw Americans on the moon and looked down and saw America at its worst. And literally that experience in no small way is what brings me to this day. And I was six months old. My mom was 24 and widowed and we moved in with my great grandparents for the first three years of my life. And I got lucky. When I was three, my mom married a wonderful, extraordinary man who adopted me, Eddie Phillips, brought me into a family of great blessings. My grandmother became Dear Abby and my aunt Anne Landers, so I grew up in a family of a lot of advice. And I've lived on both sides of the advantage and I recognize it. I remember the day I turned 26 and I counted the days that my father had lived, my birth father. And I remember the day after I had lived as many days as him. My life changed forever. And I became inspired, joined our family business after college, ended up running our beverage business. We created Belvedere Vodka, which we sold to LVMH and then got into the ice cream business and did the same thing."
Were you guys created Belvedere?,"Yeah. My father and I and our partner Steve Gill went on a trip to Poland in 1993 hoping to sell them Philip's Schnaps, which we made in Minnesota. We thought Eastern Europe was ready for peppermint and peach schnapps. And we were touring distilleries and we see both in duty-free in the airport and in the distilleries, the most beautiful packaging we had ever seen in the spirits business. And now, mind you, this is when absolute and Stoly were like the pinnacle of luxury. Right. A $15 average now. Yeah. And my father immediately, yeah, sat at a restaurant that night, literally, this is a literal napkin story."
"He on a napkin created a little matrix and said, if Stoly and Absolute are $15 and they're the most premium in a fast-growing category, why shouldn't there be a $25 vodka and why should this not be it?","So we negotiated with the Polish government. Our partner, Tad Dorda, from Poland helped us. And we first obtained the distribution rights. And then when Poland privatized their spirits industry, we acquired the distillery and the IP, and the rest was history. And Cork finished beautiful bottle. We sold it. We talked about the lowest common denominator, the pens we used to write the orders, the way we carried it, made all the difference in the world. And then we used that same template in ice cream because what we found is in every category, consumer product category in which there are two main competitors, Coke and Pepsi, Stoly Absolute, Ben and Jerry's and Haagen-Dazs, they tend to fight to the bottom, lower pricing, you know, frankly, demeaning consumers. And there's always an opportunity to introduce something a little bit more premium, a little bit more special that's still an affordable luxury. And Belvedere, by the way, was built by Jay-Z. I can tell you that story if you want to hear it. It's an extraordinary one. Yeah, yeah. Tell that story, too. Yeah. You're our kind of candidate. We're like, yeah, you just got to vote, apparently."
"We're all looking at you like, who is this guy?","This is awesome. So when people ask me about my platform, I'll say I'll be a storyteller about vodka. I'm ready to start popping bottles over here. By the way, that's exactly what Jay-Z did. Sax and I popped many a Belvedere bottle when we had our run in LA. True or not true, Sax. It was a tough choice between Belvedere and Grey Goose. Oh, I'll tell you that story, too, by the way. So we introduced Belvedere and it and by the way, what we learned in hindsight is that our aperture was way too small. You know, we were way too, we sold it by the bottle, not by the case. We only went to restaurants and bars at first, not to the big stores. We wanted it to be special and we completely underestimated the size of what this category could be. Sydney Frank, who introduced Grey Goose, took a much bigger approach. Anyway, so I'm sitting at home getting ready for work one day. I have MTV on and it's probably a year after we introduced Belvedere. It's doing well, but not not big."
"So sorry, this is like mid 90s?","Yeah, I can't remember the year, Chamath. It's probably, you know, 95, yeah, 90s thereabouts. Watching MTV, I see a Jay-Z video and it is all Belvedere. It's in the fridge, he's holding it, people dancing, he's pouring it on him and I froze, called my dad immediately who of course didn't have MTV on and I said, you got to turn it on. He couldn't find the channel. MTV repeats the same videos, you know, five, 10 times a day. So we got to the office and sure enough, we had the TV on. It came back on, the whole company gathered at that time, we were probably 10 people and we gathered around the TV and watched this video and I'm telling you guys, within two weeks, the brand completely popped. And my dad, Jay-Z ended up calling my father. They had a dinner in New York City, a memorable one for both. Actually he ended up introducing a vodka some years later called Armadale. And it failed miserably. But it was one of the first times that I think in this new culture of influencers and celebrity endorsers that that magic happened. He almost literally made Belvedere. So that's the story."
Did you guys sign him to a deal and pay him money?,"No, in fact, we talked about that. And the court, so this is the brand foundation of the brand house was authenticity. We didn't do a damn thing that had anything to do with anything that wasn't true. The makers of it, the product itself, we didn't pay people to talk about it, unlike Sidney Frank with Grey Goose. So we chose not to. It was all natural. And then here's the other cool thing. And this is how my campaign is going to work. We sent 200 bottles in very special, beautiful boxes to 200 influencers. We believe that if we could simply seed the brand with 200 people all around the U.S. that they could be the content makers and the advocates, the ambassadors. In fact, one of them went to this guy right behind me, Bill Clinton. And Robert De Niro, another example, Robert Redford, you know, leaders of the industry and actors and the like. Robert De Niro gets one of these things. And there's a note inside with a picture of the distiller, Bogdan Zalensky. It said, watch page three, the Tiffany section, I'm sorry, the Tiffany location of the Wall Street Journal on, call it, it was like Monday, February 6th. Only 200 people knew what was coming. The ad in the paper didn't show a bottle of anything. It just said Belvedere. Bogdan wants to know how you like it. So we literally did an ad that cost, gosh knows, back then, probably $100,000, tiny little top corner ad that spoke to 200 people in the United States of America that had no idea if nobody else knew what it was. Robert De Niro goes to the Beverly Hills Hotel or the peninsula, I can't remember. Orders of Belvedere Martini soon thereafter. The barman says, Mr. De Niro, we have absolute, we have Stoly, I don't have that brand. And he says, I don't think you heard me. I want a Belvedere Martini. So the barman sends like the bar back to whatever the wine and spirit shop is on Rodeo Driver and Beverly Hills. And the guy comes back with a bottle and the entire bar, watch this little episode. And I'm telling you once again, within a week, that store was selling through Belvedere like it was water. So these little moments where you identify the right people and I mind you, this is in the analog era. There was no internet. There was no social media. This was people simply talking to people. So we sold Belvedere to LVMH and then we looked at the ice cream category. So Ben and Jerry's doing the same thing. If you can tell us about that."
And why do you sell it when it's working?,"I guess maybe it's a question. You know, I'll tell you, well, this is not a story I've shared with many. They were very disingenuous. And it deeply troubles me to this day. The way that my father was treated, the promises that were made simply to get a deal done and then not kept, I think is a reflection on principle. And I'll leave it at that. A lesson learned. In fact, rather than going through a competitive process, which I think any enterprise would do to maximize value of a brand, our family ethos was a little different. And I think we bit and in hindsight, it was a mistake. But I'll leave it at that. You learn less. You learn lessons every experience to this very day. I'm learning them every day on the campaign trail, too. That was one I would never make again. All right. Well, you got the two Davids votes with the vodka. You got mine with the gelato. And if you launch a luxury fabric brand or sweaters, I think you're going to get some up. First, I got some other work to do for eight years. So we'll do that afterwards. I'll just wrap this long story up. So we introduced, you know, Tlenti obviously does well. We sold it to Unilever. Then I opened a couple of coffee shops with my family in Minneapolis. I think it just would be kind of a fun folly. And then we're watching the 2016 election at home. I thought I'd wake up the next morning. We had Hillary Clinton as president. Not that that was thrilling to the world, but it would have been safe. And lo and behold, you know, it happened. And I remember telling my family that night, like, look, give the guy a chance. He's not going to act like that in the White House. The presidency changes you. It humbles you. It moderates you. And my family thought I was a joke. And I woke up the next morning. My 16-year-old was in her room crying. My 18-year-old was a freshman at college. We FaceTimed her, and she's crying. And I sat at the breakfast table, guys, and I promised my daughters I would do something. I raised them to be participants, not observers. And I looked around at my district. I thought maybe I'll run for Congress. I looked around, and the district had not been won by a Democrat since the 1958 election. This is now we're looking at the 2018 election, 60 years. And the man who had won won his fourth term by 14 points. And people told me, that's crazy. You know, you're out of your mind. You're giving up a good life to run for misery, and you'll never make it, and you'll embarrass yourself. Which is why I did it. And not only did we win, we won by 12 points. We had fun. We used invitation, not confrontation. And I drove that little van all around the district to the most unhospitable parts. I opened the service window. I served coffee. And I sat, I put two chairs out, and people would just come up and talk. And I found magic in just letting people share what's on their mind. They're so unheard. Anyhow, I get to, well, I can tell you now, I want to tell you why I'm doing it. But that's the story of where I came from, and why I'm doing this, and look at the end of the day. I'm the one of those that got lucky. You know, there's a lot of kids who lost their dads in Vietnam who did not have the magical moment that I had to be adopted by an amazing father. And that was the difference for me. It's my job to make sure others get that same chance. Simple as that. Before we jump into the future about why you're running and what you see for the country, talk about the years that you spent in Congress."
And what do you think is working and what isn't working?,"I wish we had three hours. I get there, Chamath, I get there the first week of 2019. And like all of you that come from organizational enterprise experience, I assume that Nancy Pelosi and Kevin McCarthy would have a strategy to introduce the new members of Congress, both Democrats and Republicans, you know, get to know each other, do a ropes course, you know, and build some trust or something. And my goodness, it was just the opposite, guys. We were put on separate buses, going to different events. And I realized right away that they had a systemic segregation strategy on day one. And I'm sincerely, the two parties, this is what I've learned. We talk more about this. The only people that want to protect the status quo of the duopoly and the political industrial complex that just surrounds it all are the two parties. And it is destructive, and I will get into that. But I recognize right away, all of my colleagues, that the leadership in both Democratic and Republican side, they wanted to keep us separate. They did not want to give us education and information. And they wanted to keep us so busy that we could not become threats to their power structure. You can imagine, members of Congress tend to be pretty ambitious people, and ultimately they were smart to do that because they made members of Congress, they do this day, raise money all week long. 10,000 hours per week is what senators and House members spend raising money. I've got a bill, actually, that would preclude it from 8 a.m. to 5 p.m. because it's such an unmitigated joke and disaster. The fact that in the United States that a PAC representing a special interest or corporation can hand a $5,000 check to a member of Congress at a steakhouse on Wednesday evening, and then that member serves on a committee in which that business or special interest has business in front of the next day is the most unbelievable form of legal corruption you could possibly imagine. So that's one. Needless to say, I resolved right after that first week of orientation that I would do it differently. I befriended my Republican colleagues. My wife, Annalisa and I started having bipartisan dinners at our house. I joined the Problem Solvers Caucus. I hope you guys know about it. It's the most important small caucus in Congress. We're now 32 Democrats and 32 Republicans committed to doing what we're supposed to do, get to know each other, talk policy, and try to make a difference. Now we're the workhorses, not the showhorses, so you don't know most of our names, including me. But we were the ones invited to the White House in like week three of our service. I was one of four Democrats, there were four Republicans that President Trump invited to the Situation Room to make a proposition to get us through the shutdown, which I can talk about that bizarre hour of my life as well. And that's how I resolved to do it. Now I'm ranked, depending on the survey, number one, number two, number 10, most bipartisan members of the entire U.S. Congress and including governors. And I vote relatively progressive. It's not about just the votes. It's about the ethos. It's about Republican-sponsored bills that come from me. It's about me sponsoring Republican-led bills. And that's what makes me a little bit different than I think just about every member of Congress, not to mention I think I'm the only one that's willing to torpedo a career so that the country isn't torpedoed by this nonsense and dysfunction. There's a lot more to talk about, but it all starts with a systematic segregation and a focus on fighting each other instead of fighting for each other. I can talk about it all day long. Let's start there, Dean."
What?,Give us the assessment of what's happening in the White House right now.
"Before we talk about your candidacy, just like, what's going on?","Well, let me just say I respect President Biden. He's a man I've had in my house for an event. He's a man with whom I've flown on Air Force One twice. He did a beautiful video for my daughter. He called my mother. I think he did a fine job. I think he was the only man that could have defeated Donald Trump in 2020. And I have to say, I think it's fair to say too, he's probably the only Democrat who could and will lose to Donald Trump in 2024. He's a human being. He's now in his 80s. He is clearly on the decline. He's not incompetent. I believe he's surrounded himself by competent, able, principled people. And I believe the White House is running as a team, as most do."
But do I think that he will be in a position to continue leading this country in the future?,"I do not. I think I'm joined by about 75% of the country in saying that. I also believe the policies that we passed, for the most part, are investments for the future. In infrastructure, the CHIPS Act, I think is a very important bill, which by the way has national security implications, as you guys know. The Inflation Reduction Act, a bizarre name for a bill that's really an energy and climate bill, I think is pretty good legislation. And I think he reconstituted our allies around the world that had been frayed to a point of great danger during the Trump administration. So I salute the past. But this is really an election about the future. It's about a generational change. It's about creating, you know, really a new American century that will be powered by systems, structures, people, technologies, that I'm just afraid that President Biden and former President Trump can't even comprehend, let alone create thoughtful policy to both nurture and also manage. And I think that's where we're at. And I want to, I think we have wars overseas that I think in no small part are caused by a generation that is so focused on techniques and tools of the past that they can't even dare look to building peace for the future. That's why I think why we have the Middle East still going. That's why Ukraine, you know, the vice president has some ownership in some of these issues that I'm afraid have to be exposed and they're the truth. And I'm happy to talk about them. But most of all, I'll wrap it with this. Affordability in the United States of America is absolutely the most challenging issue facing Americans. They don't believe that their government is listening. They don't believe the president understands. They don't believe Congress is able to do anything about it because we're so dysfunctional. And that's another mission that I'm on right now. To end this nonsense, I am going to build a team of rivals. I will have a White House and a cabinet comprised of both Democrats and Republicans, the most able leaders imaginable, who have run multi-billion dollar organizations in some cases, understand customer service, will employ zero-based budgeting to the extent we can. We will employ a world-class consulting firm to look at every single government program, system, structure, and personnel to identify ways to save money. These are things that this president, and frankly no president, who doesn't have business experience, nonprofit leadership experience, and government experience could possibly imagine because they're so stuck in their siloed ways of thinking he's been there for 50 years. And it's time for change. I was three years old when he became a senator. So let's get specific on the issues and go into foreign policy, which is David Saxe's, I think number one issue of this election. Of course."
What do you personally think and what do Democrats think?,"I don't want to impress upon anybody or give you the sense that I think he has a form of dementia or Alzheimer's or significant cognitive decline. But anybody who pays attention can see the change. And I'm not, you know, people are saying that I'm causing his problems. I could risk his, you know, reelection. You know, I'm not the guy that has him losing to Trump nationally down in five of six battleground states, the lowest approval ratings in presidential history, almost. And I'm certainly not the guy that has shown his, you know, his decline. That's on video. That's on audio. You see it. It's natural. He's a human being for goodness sakes. All I'm doing, you guys, is saying the quiet part out loud. The only one."
"The question is, is anybody not talking about this?","Of course they are, you guys. You've really created an opportunity for you because like you said, everyone's talking about this, but no one's willing to say it. Of course."
