Question,Answer
What do you think?,"I'm not being thrown flowers and parties. Let me tell you that. Guys, I'll tell you. I think most would consider me an affable, friendly, well-liked member of Congress. I know that. That's my ethos. My friends are still my friends. I think they're disappointed because this is not what you do when you're a member of a party. You fall in line. You shush up. You sit down. You get in line. You do nothing to upset the apple cart of others who've been waiting in line perhaps a little longer than you. You can imagine the pushback has been strong, the arrow's sharp, and the pain quite significant, but nothing compared to the pain that Americans are feeling right now. That's why I'm doing this. I should also let you know, I had no intention of doing this. A year ago, I was on a radio show and a host asked me if I thought the president should run again. I said, of course not. He implicitly, if not explicitly, said he would be a transitional president, kind of the bridge. Most members of Congress thought he was going to stand down. That's why Newsom and Pritzker and Whitmer and so many others were kind of making their plans. I said, and if he doesn't pass the torch, then we should ensure at least that the stage has newer generation candidates to give voters a choice. Anyway, months went by. I started seeing the polls change dramatically. The tenor and tone of constituent discussions with me and every single one of my colleagues was changing graphically. All the independents, moderate Republicans that voted for the president, I think for the right reasons, were increasingly telling us that they're not going to do it again. They may not vote for Trump, but they're not going to vote rather than vote for Biden. Over time, it kept to a point, actually, guys, where I resigned from the House leadership table because my position was so incongruent with those who were in positions to do something about it that I didn't feel it was appropriate for me to sit with them anymore. I was really frustrated. I called Gretchen Whitmer. I called JB Pritzker. I made public calls to the candidates whose names are better known than me to jump in. The water's warm, you guys. It's a democratic primary. That's what we do. Not only did those two not take my calls, which they would have any other day. They had their political operatives take those calls, and they told me, please, don't use their names. That's the culture, that's the culture, you guys, that we're dealing with. You will be blackballed. You will be disenfranchised. You will be let out the door if you so much as even issue a word that you might challenge a sitting president of the United States. This is the United States of America. It's appalling. Anyhow, I'm frustrated. We saw that happen with R.K. Jr. because he declared initially as a Democrat, and Biden wouldn't give him secret service protection despite the enormous personal safety risks and threats he's actually had. Which is the same thing for me, by the way, guys. You can imagine. Yeah. And the biggest line item in my budget right now, by the way, is security. The biggest line item, the second biggest line item that's going to suppress that is getting onto the ballot. Right. Well, that was the thing, is they wouldn't let R.K. on the ballot. Exactly. They wouldn't debate him. They just wanted to pretend like he didn't exist, and they basically drove him out of the party. So now he's running as an independent."
Do you think you're going to be able to get on the ballot as a Democrat in these primaries?,"Absolutely. And we're making those choices right now, David, because first of all, it's obscene. I want to let you all know that in a country that prides itself on being a democracy, a Democratic Republic, I can't even tell you how many states literally create high barriers to entry to satisfy the two parties to ensure that their coronated candidate has an advantage over anybody else. I'm talking about..."
What are the most egregious ones?,Give us an example of what you have to do. The most egregious are oftentimes the deepest blue. New York is close to impossible. When I say impossible...
How so?,"Explain it to us, like what you have to do. So the reason I started in New Hampshire is it has a 103-year-old tradition of being the first in the nation primary. They take this really seriously. They're the most engaged Americans in the country. They have a process. We walk through the snow, we answer their questions. And you also... All you need is a $1,000 check. You got to be 35 years old. You got to be born in the United States of America. And you too can become a candidate for president of the United States. That's what I did. They have the most beautiful ritual in the state house in Concord, New Hampshire that is worth going to one time just to see the majesty of filing for president of the United States. 21 of us on the Democratic side of the ballot because that's how it should be. Take a state like Virginia... Wait, wait, hold on. There's 21 people running for the Democratic... That's incredible. I have no idea. Yeah, Chomach. 21, Marianne, Williamson, and I are the best known of those 21 because the president of the United States chose not to. So that's how you have it. You asked about other states though. New York. Virginia."
"So, it's $450,000 to $500,000 to pay consulting firms, to pay people $25, $26 per signature to just sit outside and just say, hey, can we get your signature to get this guy in a ballot?","No, it's not grassroots. It's not old school, caucusing democracy. It is pay to play. It's pay to play. And we would need it. We would need... Well, we're going to have to raise. Probably six... Yeah, maybe... I'm sorry, maybe less than that. Maybe $5 million. We have a staff of three people right now and legal counsel just to get my name on a primary ballot. It's absurd. Marianne Williamson, she's not going to be able to. RFK as an independent, by the way, I think he should be. I'm not someone who I'm concerned about some of his positions, but I think he should be able to get on the ballot. You guys, it's absurd. It's obnoxious. And what I've discovered in the last three weeks is going to be my mission after being president to fix because it is going to destroy the country from the inside. And that is why we have the kind of candidates we have year after year after year and Americans say there. And that's why we have Trumpism. I like the fact that... Of course. You know, most people become politicians as a career. I've parked against this for a while. And so they have everything to lose if they stand up against the party and they stand up against the political establishment within which they're meant to operate. And therefore just a few people get to make all the decisions and control all the levers and everyone else is just a marionette. And they stay there forever, Dave. They stay there forever. And there's no term limits, which is what we need. That's why we need them. The fact that you're self-made and you don't have anything to lose, you can leave Congress and you'll be fine. You're a citizen that can go back to work and do what you do. And you're doing this as a service. You're doing this because of your interest in the country. It sounds like... Not to say that other folks don't, but they're largely going to be driven and unfortunately adversely affected by the fact that they have to fall within the way that the game is played in order to operate and will not stand up and save the things that need to be said in order for us to make progress and get out of these situations. But... Those are the perverse incentives. Exactly. I commend you for doing it. I'm glad it's possible. I think, Jason, we should probably talk about the topic. We have two topics that I think we're all passionate here. The first is foreign policy. The second is the budget and are out of control spending. Let's start with Saks. You said you wanted hard questions. Welcome to the pod. Saks, foreign policy. Let's go. Let's bring it. Before we get on, you both said hard questions. Let's go. Please. Meet David Saks. Hey, David. Dean, you said a minute ago that one of the reasons why the world's on fire is because of the Biden administration's handling of foreign policies kind of led us to this point. I think there was a really good example of this. A week ago, there was a new report out by a former UN Assistant Secretary General named Michael von der Schulemberg who worked at the UN for 34 years. He did a detailed study and reconstruction of what happened in March of 2022, so the month after the war. What he concluded is there was a bona fide deal on the table between Russia and Ukraine where Putin was willing to pull back and leave the territorial integrity of Ukraine intact if Ukraine would agree not to become part of NATO. This is something that's been discussed. There have been many reports of this over the last several months. Ukrainian proff to have a story about that. Now, there's yet another confirmation that such a deal was available. Yet, Boris Johnson and Joe Biden said, no, we want to pressure Putin not work out a peace deal with him. Thanks to Western intervention, that deal never happened. Now, we're 20 months later and Ukrainian counteroffensive has failed. It's been a fiasco. The casualties have been absolutely massive. Horrifying. Horrifying. You saw there was this article on Time Magazine, this new profile of Zelensky where his own aides and advisors say that he's delusional. He can't accept that they're losing the war. They furthermore say that even if the US provides more weapons, more aid, they don't have enough men, they don't have enough soldiers to use them. Things are going that badly. I think there's now a fear that Ukraine could collapse in the next year, even if we provide more aid. I guess, I know that early on in the war, you supported Biden's policy."
"If you were president, what would you try and do differently now to try and end this thing?","Well, first of all, I think we have to back up to 2014 to talk about this, David. First of all, I've seen that reporting. I do not have confirmation of the validity of that. If I did, I could talk about it more directly."
"If that's the truth, I would first ask, did that include Crimea?","Secondly, it's not a United States decision about whether or not Ukraine should agree to a peace deal. It is Ukraine's decision, plain and simple. I do want to turn back the clock a little bit because I think this all kind of plays together. By the way, it didn't include Crimea. But Zelensky was willing to go for that deal. And it was the West who intervened and said, no, we want you to pressure Putin and fight. And David, like I said, I never speak to him unless I can verify that myself. And I've not seen that intelligence in the skiff. I've not seen that presented to me. And by the way, there are some times where I don't know. Most times none of us know everything. If that is the case, I would absolutely answer this question differently. But based on what I do know, I want to turn back the clock to 2014. This is where foreign policy matters. President Obama was a great orator, I think, an inspirational leader. He came to the US presidency with only organizing state legislative and a couple or few years of Senate experience as a very young man. And Joe Biden was his vice president. And when Vladimir Putin took Crimea easily, that set the tone for what's going on right now. And we have not done a very good job of prevention. That's true in health care. That is true in poverty. That is true in our foreign policy, which is, by the way, maybe what happens when you spend 83 billion a year on diplomacy and 850 billion a year on bombs and missiles. Not to mention, go back to Eisenhower and the military industrial complex. David, you well know this. It does. It controls a lot of our policy because those who are making great profit find ways to influence those who open the piggy banks. I think the Crimea moment in 2014, the writing was on the wall, that was Putin's test. If I take an inch, maybe they'll give me a mile. And what happened during the Biden presidency, of course, he took the mile. I think it has implications now, though, David, and all of you. If we do not do our best to support Ukraine and defending, I think it doesn't just send a message to Putin, a post-Putin Russia, which is going to be a failed nation with a brain drain and something we should talk about, but also sends a message to Iran, North Korea, and even China. I want to talk about that, too, because I think we have a much brighter future with them than most people portray as it relates to Taiwan. And that's the sad truth, is we get ourselves into these situations that then layer up the consequences by withdrawing. And Afghanistan was another example of that."
Who in their right mind?,"Especially... Boris Johnson. Well, by the way, that's where you get when you get people like, well, I'm going to make this case, as you guys know, for comprehensive new generation of leaders all around the world in our country and in others that are sick of this nonsense, sick of the bloodshed, sick of enriching enterprise at the expense of human beings. It happens here, it happens in Ukraine and Russia, and it's happening in the Middle East, plain and simple."
"Saks, anything else on foreign policy you want to go to?","Hacking off now would be, I think, a shameful, horrible mistake. The one thing I would argue right now, David, is those who are most likely going to be subject to Putin's terror, the countries in Europe, should be carrying a much bigger, bigger part of this load. We have 750 bases and installations around the world in 80 countries. We are the most dominant presence in world history of any government, and we spend more on our military than the next, I think, 11 nations combined for God's sakes. If anyone thinks that a kinetic risk to the United States is the most likely harm that will be done us, not cyber or not social or not biological, I think you're out of your mind. Those are the risks that I think are most threatening, that I think this president does not quite understand, and we have to recomprise and recommit to diplomacy and defending ourselves against the most important literal risks, including nuclear weapons that can be carried in a backpack and detonated in New York or Tel Aviv or anywhere in the world. And if we don't start changing how we do things, we're not going to be ready, and we are just sitting still in dysfunction. I'm going to change it. Let's talk about China for one second, and I'll give it to you in two arcs. Arc number one, the comments that President Xi made yesterday, which were very, if you just heard them or read them, were very specific. We have zero desire to seek Chinese hegemony. We have zero desire to find a cold or hot war, but then there is what wasn't said, which is part of what you said, which is, well, okay, maybe there's no kinetic risk. But the cyber risk is still there. And actually the psychological war risk is there. So two questions."
"And then the second is, how do you react to what's happening with this TikTok, Osama bin Laden, Cyop thing that just seems to be, frankly, just getting out of control here?","I agree. Well, let me say I was so pleased to see President Xi's remarks. I think President Biden responded by saying we should trust but verify. I think that's appropriate. I was troubled though, when a question was shouted out to President Biden on his way out about whether he considered President Xi a dictator and he said, yes, he's a dictator. And I think that may have undermined this entire rapprochement, which I think is terribly important. You know, words matter. The playbook matters. And the negligence or ignorance of another culture as it digests our words, our actions, our intentions is very consequential. And unfortunately, we see this pattern with the president of doing what he did today in using that term. Whether or not it's really true or not, there are ways, as we all know, to simply not comment, because that is going to undermine, I think, a very important, otherwise very promising outcome. And, you know, to your question, I'm concerned that we have made China, perhaps into the very enemy that is stensibly now our military industrial complex wants to defend us from, which happens time and time and time again through our history. And it concerns me deeply. We should be partnering with China. Our disagreements are real. I think they should be litigated and bridged with diplomacy, not destruction. And imagine what can be accomplished in this 21st century world if two nations like ours recognize the potential of spending less on destruction and more on human beings. You know, it astounds me."
Do you think TikTok itself is a threat to the United States?,"I wish you, if you were president, ban it or force them to divest and remove the servers in China and the algorithm from China, et cetera. I'll make this really simple."
Do you think it's actually being used for PSYOPs?,"I'll make this really simple. You know, if we want to change our constitution and change what we consider speech, change how the federal government or any domestic government affects people's rights to what they watch, what they read, what they eat, how they pray, how they think, where they go, with whom they congregate, you know what, that's up to Americans. But I think to target one app is a huge mistake. And my, I have a very simple solution. Hold every single platform to the same standard, transparency, their algorithm, have an independent commission perhaps that is charged and responsible with assessing and holding those platforms to account. And if any of them violate the terms that we pass into law, then they should be banned. But to target one, I think it's not accessible. Well, we do have foreign ownership rules for media outlets, yeah. So it is as many more users and is much more powerful with the algorithm."
So then how would you respond to that sort of counter argument?,"I'm just going to say this. If we want to change our constitution, this is what the Supreme Court, I'm afraid, is going to say if we start doing this, then change the constitution. That's what they said, by the way, about women's reproductive rights, you know, in the absence of Congress doing anything, in the absence of that, we're going to assess it the way it reads right now. I don't think that's necessarily really possible without a significant Supreme Court challenge."
"My belief is yes, is it a threat?","Yes, it's a threat. By the way, every social media platform is a threat when used by malign actors."
"Do you think we should enforce reciprocity if we allow TikTok, they allow Twitter, Facebook, Instagram, China or...?","I think that's the kind of thinking Jason and I like. In fact, reciprocity as it relates to IP enforcement of IP, of theft, of trade, you just hit the nail on the head, reciprocity. Let's be reciprocal in the nature of a relationship."
"If you're going to ban our apps and our platforms or our products or our brands, well, why...?","This is to me an opportunity for the next generation to say this is nonsensical. You know, if you're going to succeed, by the way, China, you all know, has sign... They have a bubble they're facing that will make ours in 2008 look like a gumball by comparison. And that is coming down the pipe. I think that has a lot to do with this kind of step towards rapprochement. But yes, reciprocity and to know that Facebook is not allowed. Yeah, perfect example. But in the United States, that doesn't change my contention that we should set the same standard for every platform, every media entity, whatever it might be, hold them accountable. And if they don't qualify or perform, then they're banned. Give us your just maybe societal then commentary on the number of people on TikTok right now. No, it's sickening. Advocating for... I don't even know what you want to call it. I guess reading and sympathizing... Yeah, with Osama Bin Laden's... It's just... Justification. Well, first off, I'm sure you guys do too. I look at TikTok. I consume as much media as many platforms as possible. So I understand why some of the nonsensical perspectives are being shared with me by so many people right now. So I get it. You're fun... But back to the fundamental question. What do we do... This has been, by the way, an age-old issue since our very founding. It used to be anonymous pamphlets that would spread misinformation or condemnation and fire people up. Now it's just instantly available. It doesn't matter if you have a printer, you can push a button."
"And yes, am I concerned?","Of course I am. The fact that when I'm spending time on college campuses right now and listening to otherwise really well-educated privileged kids saying things that are so nonsensible, so ignorant, and so shocking, I know where it's coming from. So I understand the problem just like all of you."
I think this question is what do you do about it?,And all I'm saying is we should have the same standard for every platform because the same issue is on every platform. That is my only contention. What do you think about...
"You're about to say this, but what do you think about what Nikki Haley suggested?","Yeah. You know, I was shocked that people... Maybe just frame for the listeners who don't know what she said. So Nikki Haley... And I asked Mark Zuckerberg this one, so too. I'll tell you. Nikki Haley proposed that every platform, every social media platform have verified accounts. No more anonymous accounts. And she got ripped. Got ripped. You know, I understand this is... It's a reasonable argument to have, but I got to tell you, I'm surprised that that's something that seemed somewhat reasonable to people who are paying attention would have such a response that she actually retracted it. I'm not proposing it. I'm just saying that I think we should be throwing ideas on the table. And I know from experiences like you guys, when you hide behind a fake name, you can be not just a jerk to someone, you can be downright dangerous. When your name's attached to it, you behave in a very different manner, not a mention when you're face to face. So I don't think that was as absurd as people considered it."
"I asked Mark Zuckerberg after a financial service is hearing a couple years ago, you know, why doesn't Facebook just verify accounts, make this so much easier to hold people accountable and have higher standards of accountability?","And he said it would be a competitive disadvantage. And of course it is. He only had to do it. Yeah. And this has been tested. Korea had their version of this in order to sign up in Korea for their social networks or ISPs, you have to use your social security numbers. Sure, that makes sense. And the other thing, guys, is you know that, you know, if you write a letter to the editor of most major newspapers, you have to, you have to attach your name to it. It has to be verified. I just think it's a conversation that we should be having. And by the way, you know, it might be time to read Future Shock again by Alvin Toffler, who predicted so much of this mess in which we find ourselves the incapacity of human beings to adapt to such rapid technological change, which by the way, you know, you on this, you just the handful of you on this, on this podcast, have more expertise than the entire United States Senate and Congress combined as it relates to the issues we're talking about. On tech, there is no capacity, no competency."
So on whom do we rely?,"The very lobbyists being paid by the very enterprises that so easily can set the standards if there aren't people of better capacity. And only 11 members of Congress have an engineering degree. Only 11. By the way, I was, I was on Kevin McCarthy invited me to join his AI cabinet, which just, it was a few four Democrats, about four Republicans. We had our first meeting and started making plans right before he was deposed. And now I don't know anything, if anything's going on in that respect."
Where do you stand on the spectrum of decorum online on one end and free speech on the other?,"Where the absolutists would say absolutely not verified accounts as a non-starter because it just fundamentally undermines the First Amendment and this other thing, which is more organized decorum. Chamath, it's, it, I think that's the issue of our day. Maybe the most important when it's true both online, it's also true in our Congress right now."
"Where's that intersection between debate, discord and, and comprehensive division?","I don't have the good answer for it right now is the truth. And I'm afraid that if you interpret our Constitution, free speech has to be met with more free speech. But I'll tell you that, but that also will conflict and increasingly is with the right to pursue happiness. I mean, that's just true. I mean, it's a, it's a, it's the most complicated issue in our era."
