Question,Answer
"When Teach for America teachers outperform teachers who have tenure or been at it for 10, 20, 30 years, does that not say the quality matters?","It's not the school, how it looks, but anyway, I would reinvent and the other thing is this, you and I'm sure like you guys, I remember a couple teachers that made a huge difference in my life, and they're about 50, I could barely remember at all. They should all be those two. And then furthermore, if you think sitting in front of a blackboard is the way to teach kids in this day and age, no, you got to get out of the school. You got to look at Scandinavian countries and Asian countries and how experiential learning, learning from the best, most extraordinary educators in the world through screens on occasion, but to experience, AI is going to fundamentally change employment as we know it. We have nobody in Washington that gets it. We need an administration in 2024 that does and begins to simply rectify all of these problems anticipating the change that's coming. This administration is not going to do it and education should be redesigned based on the change we know is coming. And I don't have all the answers, but I know a lot of people out in California and around the country and around the world who could help us repraft."
Or is it?,"No. No, you think we should. I think it should be, I think it should be very, you know, Jason, I would say right now it should be very limited. And this is where back to the conversation about anonymous accounts. We do have to set, I think, some standards and penalties for nefarious use of AI. If we don't do that early and set the tone, I think it will get out of control. So to me, that's all we should do right now. And let it grow, let it expand, let large enterprises and small come up with extraordinary ways to save money, by the way. AI is going to save extraordinary sums of money for the federal government and healthcare for businesses. We can anticipate how employment will change and what jobs will be jobs of the future. But if we don't think about that now, we're going to do what Congress always does, get caught off guard, have to come in on a midnight, ill-prepared with a thousand-page bill that nobody understands because it was written by a lobbyist that had skin in the game and does not serve America. And that maybe wraps up this whole conversation. Yeah, I'm just not sure folks really understand in Congress what they're doing. It's front. But the difference between foundational models and the utilization of those models in an endpoint are very different regimes to think about regulation. And that framework isn't even understood. Not at all. We're not even talking about regulating outcomes or actions. We're talking about regulating the infrastructure that could cause various outcomes. Regulate. I'm very much against where this is all evolved to. And I think some folks want to say, hey, this is a regulatory capture moment. But I want to see someone in Congress stand up and demonstrate an understanding first before they can even have the right to articulate a framework for regulation. Well, Dave, I can tell you, there's one man. I want to shout out this guy. Don Beyer is a former US ambassador, Democrat from Virginia. He must be 70. He went back to college, I think Johns Hopkins, and just received or is pursuing his degree in artificial intelligence. That's the kind of representative."
Isn't that cool?,You would never know his name because he's not on Fox Remus and BC Screaming at Night. But those are the kinds of people that should be celebrated. A lot of my Republican colleagues that got thrown out of Congress because they had the audacity to support the Constitution when Trump was impeached the second time. Those people I celebrate.
"I got a run, but can I tell one quick story to wrap my whole story up and about what I want to try to do?","At the end of the day, none of this occurs. None of the successes, none of the policy ideas, none of the ideation occurs if we don't repair. That means restoring friendships, our families, our communities, and our country. I do a series back home in Minnesota called Common Ground. I get six Democrats and six Republicans invited to a table. We break bread, we introduce ourselves, tell a little bit of our life stories. We talk about healthcare policy and we talk about immigration policy, which is where everything I share tonight comes from both Democrats and Republicans. It's a two-hour session facilitated by an extraordinary group called Braver Angels. I encourage you to look them up. They are remarkable doing this work all around the country. At the end of these sessions, we go around the table, and each person at the table shares a little bit about what they got out of this experience. I had an episode not long ago that sums up my whole mission. A young woman, Emily, looks across the table at Dave and says, Dave, when you drove up in your F-150 with the Trump sticker on it, I almost got back in my car, left the parking lot, and drove away. I could not bear to go in the building, let alone sit at a table with you. She said, but I got to say, I so loved sitting here. You're a good guy and I learned something. Goes around the table, comes to Dave and he looks at Emily and says, Emily, when you drove up in your Prius, I wanted to run it over. He says, but hey, I got to tell you, Emily, I've never met a progressive as cool as you and I really am glad I came to this today. And at that moment, Emily and Dave stood up in front of our table and they embraced. And to see a bleeding heart liberal and a died in the wool trumpet, do that probably was the most important moment in my entire career in service. If that is the only moment of its kind in my career in service, it would have made it worthwhile. And that is exactly what I'm going to inspire as president of the United States. Get Emily and Dave to hug it out. All they have to do is be invited for a little dinner, given some space in place to recognize their common cause and their common ground. And that's how we're going to do this. I don't see a candidate right now in the ballot that has that intention, has that capacity, or has that capability."
"So I just want to thank you guys and last thing and just, just yes or no, can everybody expect that you will be on the ballot in every state?","I can't say I'm going to be in the ballot in every state, Chamath, because I don't think it's possible between time and money. I'm going to have to make some choices. And that's just the sickening truth. I will, I want to salute Bernie Sanders. He actually made it possible for a candidate like me and probably future candidates who are subject to this nauseating system to actually still compete and get to the convention and maybe win because he depowered people like me, members of Congress that used to have outsized votes disproportionately. So versus voters. And I celebrate him because he was right. I used to think he was a sore loser. Bernie Sanders was absolutely right about a rigged system that is keeping people out of the process, keeping candidates out of the process and keeping debate out of the process. So I'm going to be in the most, I'm going to be on most ballots. I've got to raise money and frankly, I hate to be shameless, but the truth is, if we want to get on ballots, I need support and it's easy. Dean24.com, you know, I, by the way, I'm at 15% in New Hampshire after just two weeks. We thought it would take six if we were lucky. Wow. So people can throw 15 bucks our way to get on ballots at Dean24.com. And by the way, Joe Biden, 27%. 73% of New Hampshire Democratic voters do not want the sitting president of the United States as their nominee. And mark my words, we're going to bring change. Thank you guys. All right. Thank you so much. Thanks. Thanks for the time. Peace. Thank you very much. Keep the faith guys. I mean it. Love to see you again. See you later. Yeah. Great. Thank you. For 90 minutes with Dean Phillips. Everybody go to dean24.com if you want to learn more. All right, besties. I think that was another epic discussion with the presidential candidate."
"What's your thoughts, Jamath?",You set up this interview.
"Andrew Yang texted me like last week and said, would you guys do this?","And I was really interested because mostly I didn't know where he was coming from, to be totally honest. But I think his national visibility is probably going to increase a lot. My reaction is that he is who he says he is, which is like kind of down the middle. He doesn't take either extreme, any kind of take some moderate point of view and says there's a balance of this and that that can work. And that's actually good that he owns that as opposed to it being sort of a consequence or a byproduct of not getting what he wants. He kind of like that is where he starts. So I like that about him a lot. I thought he was really candid about what doesn't work. I really appreciate that honesty. He's saying some of the right things around capping Medicare, zero based budgeting, the military. I think all of those things right. I didn't like to be honest, the free speech part. I thought that that was, I don't think you can have some kind of registry of verified accounts or something. I just think that's a non-starter for America. It's a super slippery slope. But in general, I was really impressed. And his war stories as a businessman were pretty cool. Pretty awesome."
"Obviously, he's not part of your political party, but what do you think his chances are versus Biden and how would you assess his performance here today?","I was pleasantly surprised that he made the case for himself not just based on Biden's age and the fact that he's 54, but he also, I think, took a number of interesting policy stances that were a little different than where Biden is. He did it on foreign policy, he did it on domestic policy. So I think he took a number of positions that were refreshing. And a big one, I think, relates to his personal story, where he talks about how he lost his father in Vietnam and that that war was kept going much longer than it should have been, because basically the greed of the military industrial complex. And he didn't fully connect the dots all the way to our present situation in Ukraine. But at least I think he would be skeptical of the influence of the MIC in our politics. What he said with respect to Ukraine is, well, he said that it would be shameful to abandon them now. But he also said that if it's true, he wasn't willing to concede it because he just didn't know factually. But if it's true that we could have avoided the war by taking NATO expansion off the table, then it would only be common sense to do that. I think that when the histories of this are written, it's going to be abundantly clear that we could have done precisely that. So his difference of opinion with me isn't in the logic. It's just in what facts he knows to be true. So I actually thought that his position there was reasonable. If it came down to a choice between Dean Phillips as the Democratic nominee and someone like Nikki Haley as Republican nominee, I'd vote for Dean Phillips all day long. You know, one other thing I like about him is he is a business owner and he presents as a Bill Clinton Democrat. I mean, I think that it's not an accident. He's got a picture of Bill Clinton on the wall behind him. You know, he presents as a... That was exactly my takeaway too. I thought, wow. He presents as a moderate Democrat who's a little bit of a throwback to the Democratic party of the 1990s. If RFK Jr. is trying to bring back the Democratic Party of, say, the 1960s, the party of John F. Kennedy and Bobby Kennedy, his father, I think that Dean Phillips is more trying to bring back the Democratic Party than 1990s. Both of them, I think, are ultimately very out of step with where the Democratic Party is today, but they're out of step with it in ways that I like. So he is a candidate who I could support against a Republican who, if we ended up getting a sort of stale neocon type Republican candidate, I would take a Dean Phillips all day long."
Really?,"Wow, great. Free break, your thoughts. I mean, I think if Joe Biden runs, he obviously doesn't stand a chance just based on the structural issues that he described. If Joe Biden doesn't run and drops out, I think there are probably a lot of other Democratic candidates who are going to have deeper pockets and more support from the party and more celebrity or what have you to get themselves elected with respect to his candidacy and whether it's a realistic kind of campaign, I would probably argue no. But what I really like is the fact that he is making the case, I think in a stronger way than even RFK Jr. was on how these incumbents and how the incumbency in the party system prevents new candidates from actually participating in a true Democratic process. And it feels to me a lot like what goes on in that sense is the equivalent of like regulatory capture, but in politics. It allows these party leaders and influencers, which is a very small group of people to decide who gets to go on a ballot in the state, to decide who gets to be the nominee who decides who gets to run for president. The best thing that he's doing is exposing a system that Bernie Sanders calls rigged and that clearly, I think, is very inequitable and doesn't create a true kind of Democratic process. So it's really great to see him doing this work and telling the story. And I'm glad we gave him the forum to do that for just that reason."
"And if you were to have a choice of him or Biden, you'd pick him?",Yeah.
"If you had a choice of him or Vivek on the other side, would you pick?","No comment. Okay. Taking off my moderator hat for a minute. Loved his business story. So I grew through Chumah. Really excited to see somebody under the age of 80 run for president. And I thought there were really two powerful moments there when he said he would send special forces in and then he was pretty aggressive in his assessment of Netanyahu's leadership. And overall, he did engage with every single issue and had interesting policy issues. No, Chumah. It seemed pretty engaging there. So overall, great job, everybody. I think four for four on the presidential candidates. And just as a programming note, we have sent the first podcasting kits, the first microphones to four presidential candidates for those of you counting at home."
"What do you think will happen post this, Chumah?",Vivek got a big bump. RFK got a big bump.
What do you think is going to happen post this?,"I think that Dean Phillips is going to pull really well. The more that people get to see him. And I think New Hampshire is set up well for grassroots politics like this. It will go over very well. The question, I think Freeberg points is the key one, which is the party infrastructure has tremendous antibodies. And if they decide to shut you out, which they did very strongly and vocally for RFK, you don't have much of a choice except for one as an independent. So his candidacy is precarious not because of the viability of him as a candidate, actually, because I think it's quite high or his likeability, which is quite high or his electability, as Saq said, which against the right person is very hot. This has all to do with the antibodies of the infrastructure."
"And just a programming note, Jake, how are you drinking a chocolate milk?","I'm drinking a Core Power 26. 26 grams of protein. I'm still on my try more protein, but I did have a super gut bar earlier today, which was quite nice. Thought there was a chocolate milk. This one's got 26 grams. It's a 42 gram protein. Yeah, I don't want to give a free ad to Core Power. But Saq, in addition to the antibodies that kicked RFK out of the Democratic Party, the press also blocked him. CNN, et cetera, wouldn't let him on. The right would let him on all day long."
"Does this same antibody kind of system exist on the right at all, or is the right more open to multiple candidates just generally speaking?","No, I mean, you look at Republican debates and they are vigorous debates. There is real disagreement on the right. There are real debates on the right and there is a real working out of contested issues. The Democratic Party, by and large, is a machine. It works in lockstep. That's why what Dean Phillips is doing is so sacrilegious. I mean, he is pretty much ending his career as someone who can just move up through the ranks of the Democratic Party. Maybe this will turn out in a way where it gives him like a leapfrog, but I don't think so. I mean, I think he's basically signaling to the higher ups of the Democratic Party that he's no longer a candidate for advancement through the regular course. Got it. Yeah, one analogy is that the Democratic Party is like the empire and the Republicans are like the rebel alliance. The Republican Party is a bunch of misfits. It's a bunch of discontents. He walks. He walks. And solos. And solos or whatever. But the Democratic Party marches in lockstep."
Is because they're in lockstep?,"Yeah, they're much better fundraisers. They're more disciplined. They have their act together right now. I don't think this was always the case, but I think it's true right now. Yeah, okay. Well, we had a couple of other issues we wanted to get to. So I think we can wrap there. Great job, everybody. That was spectacular. Great job getting the candidate. Chimah, thank you for that. All right, we have to touch on what happened this week with the US and China relations. Everybody knows Xi Jinping was here in the Bay Area to meet with Biden. Yellen, welcome Xi at the plane. Maybe she's selling some treasuries. I don't know. That's what the press said. We're like some sort of piss-pore company that's selling us junk bonds. I mean, the second that she gets off the plane, she's walking our shitty bonds. Wow, listen, everybody's raising a fund right now. You know, fundraising is hard."
"They had a big auction on, what was it, 10 and 30-year bonds?","The 30-year bond bid was not really there. And so they got to get buyers in the market. They got to go get the change. And Xi's coming to raise money apparently too. She's here. Everybody's having a hard time raising right now. Pretty crazy. But Chimoth, you and I tweeted about this clip where Xi Jinping said that he's basically for peace and that we have to work together. Let me just start there with you, Chimoth, so we can get through this quickly."
Do you take him out his word?,"There were cynical people saying like, hey, he's just desperate, needs more trade, needs more business."
How do you interpret Xi's peace pipe here and his dinner with a bunch of executives last night?,"I think he's pragmatic. He's somebody that wants to not just rule over China, but he wants to do it for the rest of his life and he wants to do a good job. And I've said this many times, China's issues are endemic and pervasive and they're demographic. And so he has huge structural issues that he has to fix in the Chinese economy. And so I think all of this is just about him focusing on his priorities, which makes sense, which is really about domestic policy. There's an enormous real estate issue that has to get sorted out. There is a GDP issue that has to get sorted out. There's a youth unemployment issue that has to get sorted out. And then there's an aging and a birth rate and a replacement issue that has to get sorted out. All of these things are in enormous efforts. And so I think he's pragmatic enough to not also then add foreign misadventures to that play. And I think what you heard was him being very clear about just exactly that."
"Sax, what was your interpretation?","There's so many jumping off points here. You got foreign policy, you got TikTok, fentanyl."
"I mean, there's a long list of issues, but does it feel like we're turning the corner on relations?","Hey, they need us. We need them."
What was your interpretation on all this?,"Well, I think what's going on here is that the administration has its hands full with two wars. We still got this war in Europe over Ukraine, which is going very badly. And now we have a new war in the Middle East that caught them completely by surprise. Recall that literally a week or two before October 7th, you had Jake Sullivan saying that the Middle East has never been more peaceful. So they absolutely did not anticipate what was coming. And now we have half of our carrier groups in the Middle East positioned there in cases, blows up into a wider regional war. So I think the simple fact of the matter is that the Biden administration, this is more than they can handle. Or let's put this way, they're trying to put the China compete on hold. They're trying to put it on ice while they figure out a way to rescue this losing effort in Ukraine and to prevent the situation in the Middle East from swirling out of control. It's just too much for them. They don't have the bandwidth to deal with a war or conflict breaking out in the Asia Pacific. So I think that's the Biden administration's motivation here is they're seeking to ease tensions because they're just too bandwidth constrained to deal with it. By the same token, I think Chamath is right that she realizes that he's got his hands full with domestic economic problems. He doesn't need a ratcheting up of tensions with the United States right now. And I would also add that on foreign policy, I think what you're seeing in his remarks is a return to the foreign away from this kind of Wolf Warrior diplomacy that they had going on a few years ago where they were kind of saying these very bellicose things and they're kind of flexing their muscles in the Asia Pacific region. That really backfired on them because it raised the hackles of all those other Asian countries and it was making it too easy for the United States to form a containment alliance against China. So he's moving away from that type of Wolf Warrior rhetoric that got them nowhere and he's moved back to the rhetoric of a Deng Xiaoping who said that China's policy should be to buy its time and hide its light under a bushel. In other words, just get stronger and stronger. Don't let people get wise to how strong you are and then when the time is right, you will flex your muscles, but just keep getting stronger. And I think he's returned to that policy and you saw this with the Belt and Road Conference that in Beijing just a few weeks ago where you saw countries like Vietnam participating and I think that China, their strategy is now to try to use some honey to catch some flies as opposed to using this kind of bellicose rhetoric. And saber rattling and if we look at this chart, I think this chart speaks volumes, Friedberg, foreign investment into China has absolutely fallen off a cliff in the decoupling, the saber rattling and other countries looking to have resiliency and not be dependent on China has obviously blown up in his lap."
What are your thoughts on foreign trade and our business relationship with China and their relationship with the West and the rest of the world?,"This used to be a thing to do to make money and then it became a question mark of whether you can make money a couple years ago. And now as of this year, I would argue you are a pariah if you were trying to invest in China or do any business in China, it's almost like you can't do business with the enemy. That's the tone shift that I think accelerated in the last 24 months. And as that tone shift happened in the business community and the investment community, it obviously escalated the tenor of what does the broader relationship look like that I think catalyzed, hey, we got to simmer things down because we can't really afford to deal with that escalation right now."
"But I don't know, I mentioned this to you guys, I was at a conference this past summer, the summer of 22, it was like, Hey, maybe, you know, when are things going to get bad with China?","To this summer, it's like, if you were doing business in China, you're trying to pick up pennies in front of a freight train, like you're going to get run over. And it happened in one year, that was my observation, it was like this crazy shift. And I could tell from the tone of what everyone is saying on stage, it was like universal. There wasn't anyone that disagreed. And similarly, as you guys know, we've heard this from both political parties in the US, it suddenly became the new new thing for Democrats and Republicans to denounce China, denounce investing in China, denounce doing business with China. But too much too fast, I would argue, has led to an observation of the consequences to deeply coupled economic partner to the United States. China is the largest buyer of US agricultural exports, $200 billion a year of farm products that we make get shipped out to China. China is a major supplier to our electronics industry. We don't need to recount all the relationships, but trying to decouple too quickly, trying to call China the enemy too fast, I think has led to a realization that that's not really a tenable. So I would argue that maybe this week has been a moment, I don't know if it really changes the long term trajectory, but it seems like it's certainly a very important and critical pause in the escalation. One thing I wanted to comment, I think one of the biggest winners this week, I'd love your point of view on this guys is like Gavin Newsom. I mean, he was all over this week, like he was at the playing greeting G cleaned up San Francisco. I mean, he got a shout out from the president. He was at the dinner. I mean, do you guys think like Gavin is, you know, gonna be there when Joe says, I'll see you later. I'm not going to run again. And the new year when I spoke."
